"OfficerID","Officer_Name","Position","Email","phoneNum","username","userpassword","role"
"2205",พงสิทธิ แก้วสุวรรณ์,หัวหน้างาน รปภ.,"","0918422028",ex2205,"220505",executive
"2202",เกียรติศักดิ์ สุกใส,หัวหน้าจราจร,"","0810975928",ex2202,"220202",executive
"2501",สิทธิกร ประชุมทอง,สายตรวจจราจร,"","0862954004",ex2501,"250101",executive
"2503",เอกกร ยศธนาเมธา,พนักงานจราจร,"","0832616235",admin2503,"252503",admin
"2512",ณัฐธยาน์ พุฒนิลชนากานต์,พนักงานจราจร,"","0941989950",admin2512,"252512",admin
"2505",จารึก วิจิตรโสภา,พนักงานจราจร, ,"0861203080",officer05,"252505",officer
"2506",อำนาจ พุทธกุล,พนักงานจราจร, ,"0936692575",officer06,"252506",officer
